{
  "character": "crab",
  "style": "snes16",
  "scale": 1,
  "frameSize": {
    "w": 320,
    "h": 230
  },
  "pivot": {
    "x": 160,
    "y": 195
  },
  "animations": {
    "idle": {
      "fps": 6,
      "loop": true,
      "frames": [
        "crab_idle_0000",
        "crab_idle_0001",
        "crab_idle_0002",
        "crab_idle_0003"
      ]
    },
    "walk": {
      "fps": 10,
      "loop": true,
      "frames": [
        "crab_walk_0000",
        "crab_walk_0001",
        "crab_walk_0002",
        "crab_walk_0003",
        "crab_walk_0004",
        "crab_walk_0005"
      ]
    },
    "attack": {
      "fps": 12,
      "loop": false,
      "frames": [
        "crab_attack_0000",
        "crab_attack_0001",
        "crab_attack_0002",
        "crab_attack_0003",
        "crab_attack_0004",
        "crab_attack_0005"
      ]
    },
    "hurt": {
      "fps": 10,
      "loop": false,
      "frames": [
        "crab_hurt_0000",
        "crab_hurt_0001",
        "crab_hurt_0002"
      ]
    },
    "ko": {
      "fps": 8,
      "loop": false,
      "frames": [
        "crab_ko_0000",
        "crab_ko_0001",
        "crab_ko_0002",
        "crab_ko_0003",
        "crab_ko_0004",
        "crab_ko_0005"
      ]
    }
  },
  "sockets": {
    "hand": {
      "crab_idle_0000": {
        "x": 255,
        "y": 115
      },
      "crab_idle_0001": {
        "x": 255,
        "y": 115
      },
      "crab_idle_0002": {
        "x": 255,
        "y": 115
      },
      "crab_idle_0003": {
        "x": 255,
        "y": 115
      },
      "crab_walk_0000": {
        "x": 255,
        "y": 110
      },
      "crab_walk_0001": {
        "x": 255,
        "y": 110
      },
      "crab_walk_0002": {
        "x": 255,
        "y": 110
      },
      "crab_walk_0003": {
        "x": 255,
        "y": 110
      },
      "crab_walk_0004": {
        "x": 255,
        "y": 110
      },
      "crab_walk_0005": {
        "x": 255,
        "y": 110
      },
      "crab_attack_0000": {
        "x": 243.19212782921815,
        "y": 132.8943319946531
      },
      "crab_attack_0001": {
        "x": 263.7124772746906,
        "y": 126.23762550196213
      },
      "crab_attack_0002": {
        "x": 282.20734565131505,
        "y": 129.46342363495216
      },
      "crab_attack_0003": {
        "x": 273.44493092543246,
        "y": 123.90685146142332
      },
      "crab_attack_0004": {
        "x": 264.7847410165565,
        "y": 121.09537095150823
      },
      "crab_attack_0005": {
        "x": 255,
        "y": 115
      },
      "crab_hurt_0000": {
        "x": 230.4137592337857,
        "y": 113.02368999817159
      },
      "crab_hurt_0001": {
        "x": 241.36760958414698,
        "y": 109.87414124993532
      },
      "crab_hurt_0002": {
        "x": 250.30085393044436,
        "y": 107.58401022628452
      },
      "crab_ko_0000": {
        "x": 242.1795117011896,
        "y": 97.2227517932009
      },
      "crab_ko_0001": {
        "x": 284.292100345318,
        "y": 138.5782229505652
      },
      "crab_ko_0002": {
        "x": 273.6352762605962,
        "y": 190.32522681741557
      },
      "crab_ko_0003": {
        "x": 215.23304823160555,
        "y": 217.89424197775062
      },
      "crab_ko_0004": {
        "x": 134.2141748950644,
        "y": 197.26136288444468
      },
      "crab_ko_0005": {
        "x": 65,
        "y": 125
      }
    },
    "head": {
      "crab_idle_0000": {
        "x": 160,
        "y": 50
      },
      "crab_idle_0001": {
        "x": 160,
        "y": 50
      },
      "crab_idle_0002": {
        "x": 160,
        "y": 50
      },
      "crab_idle_0003": {
        "x": 160,
        "y": 50
      },
      "crab_walk_0000": {
        "x": 160,
        "y": 45
      },
      "crab_walk_0001": {
        "x": 160,
        "y": 45
      },
      "crab_walk_0002": {
        "x": 160,
        "y": 45
      },
      "crab_walk_0003": {
        "x": 160,
        "y": 45
      },
      "crab_walk_0004": {
        "x": 160,
        "y": 45
      },
      "crab_walk_0005": {
        "x": 160,
        "y": 45
      },
      "crab_attack_0000": {
        "x": 145.63453512532968,
        "y": 50.86296369753606
      },
      "crab_attack_0001": {
        "x": 162.5,
        "y": 50
      },
      "crab_attack_0002": {
        "x": 186.4835488110989,
        "y": 51.93875686542543
      },
      "crab_attack_0003": {
        "x": 177.69879820800367,
        "y": 50.86296369753606
      },
      "crab_attack_0004": {
        "x": 168.86234744420003,
        "y": 50.21593520777549
      },
      "crab_attack_0005": {
        "x": 160,
        "y": 50
      },
      "crab_hurt_0000": {
        "x": 105.45089430986647,
        "y": 59.47209998757131
      },
      "crab_hurt_0001": {
        "x": 127.49862955277584,
        "y": 53.40780603405625
      },
      "crab_hurt_0002": {
        "x": 150.41023672369928,
        "y": 50.38379524368568
      },
      "crab_ko_0000": {
        "x": 128.52971984404908,
        "y": 54.75223401258526
      },
      "crab_ko_0001": {
        "x": 222.94382685256807,
        "y": 35.27448499071073
      },
      "crab_ko_0002": {
        "x": 290.36806056687624,
        "y": 72.57360697096495
      },
      "crab_ko_0003": {
        "x": 300.50158371977665,
        "y": 140.56845807805445
      },
      "crab_ko_0004": {
        "x": 249.05468783552564,
        "y": 189.40919200170475
      },
      "crab_ko_0005": {
        "x": 160.00000000000003,
        "y": 190
      }
    }
  },
  "hitbox": {
    "x": 95,
    "y": 45,
    "w": 135,
    "h": 150
  },
  "atlas": "crab--snes16.atlas.json",
  "built": {
    "commit": "f716d005821cd650b1177d7112f01832f57354c6",
    "dirty": true,
    "at": "2026-09-12T11:21:02.255Z"
  }
}
