{
  "character": "golem",
  "style": "snes16",
  "scale": 1,
  "frameSize": {
    "w": 620,
    "h": 350
  },
  "pivot": {
    "x": 310,
    "y": 340
  },
  "animations": {
    "idle": {
      "fps": 6,
      "loop": true,
      "frames": [
        "golem_idle_0000",
        "golem_idle_0001",
        "golem_idle_0002",
        "golem_idle_0003"
      ]
    },
    "walk": {
      "fps": 10,
      "loop": true,
      "frames": [
        "golem_walk_0000",
        "golem_walk_0001",
        "golem_walk_0002",
        "golem_walk_0003",
        "golem_walk_0004",
        "golem_walk_0005"
      ]
    },
    "attack": {
      "fps": 12,
      "loop": false,
      "frames": [
        "golem_attack_0000",
        "golem_attack_0001",
        "golem_attack_0002",
        "golem_attack_0003",
        "golem_attack_0004",
        "golem_attack_0005"
      ]
    },
    "hurt": {
      "fps": 10,
      "loop": false,
      "frames": [
        "golem_hurt_0000",
        "golem_hurt_0001",
        "golem_hurt_0002"
      ]
    },
    "ko": {
      "fps": 8,
      "loop": false,
      "frames": [
        "golem_ko_0000",
        "golem_ko_0001",
        "golem_ko_0002",
        "golem_ko_0003",
        "golem_ko_0004",
        "golem_ko_0005"
      ]
    }
  },
  "sockets": {
    "hand": {
      "golem_idle_0000": {
        "x": 420,
        "y": 270
      },
      "golem_idle_0001": {
        "x": 420,
        "y": 267.5
      },
      "golem_idle_0002": {
        "x": 420,
        "y": 265
      },
      "golem_idle_0003": {
        "x": 420,
        "y": 267.5
      },
      "golem_walk_0000": {
        "x": 453.7737862351604,
        "y": 251.61131823301108
      },
      "golem_walk_0001": {
        "x": 431.3249401369768,
        "y": 257.9556954525241
      },
      "golem_walk_0002": {
        "x": 408.6750598630232,
        "y": 261.28902878585745
      },
      "golem_walk_0003": {
        "x": 386.2262137648396,
        "y": 261.61131823301105
      },
      "golem_walk_0004": {
        "x": 408.6750598630232,
        "y": 261.28902878585745
      },
      "golem_walk_0005": {
        "x": 431.3249401369768,
        "y": 257.9556954525241
      },
      "golem_attack_0000": {
        "x": 272.5748685778595,
        "y": 209.20617413263142
      },
      "golem_attack_0001": {
        "x": 378.4768010451064,
        "y": 265.20378926061596
      },
      "golem_attack_0002": {
        "x": 494.84203545852534,
        "y": 286.2282324394366
      },
      "golem_attack_0003": {
        "x": 470.3250642919206,
        "y": 280.8877333962366
      },
      "golem_attack_0004": {
        "x": 445.34684503900803,
        "y": 275.4741289106227
      },
      "golem_attack_0005": {
        "x": 420,
        "y": 270
      },
      "golem_hurt_0000": {
        "x": 300.520547672188,
        "y": 236.59950704976478
      },
      "golem_hurt_0001": {
        "x": 358.52932047410496,
        "y": 250.89742293763283
      },
      "golem_hurt_0002": {
        "x": 416.2464815726716,
        "y": 261.1454177894434
      },
      "golem_ko_0000": {
        "x": 421.7807101784378,
        "y": 247.74770516936812
      },
      "golem_ko_0001": {
        "x": 389.1847428668043,
        "y": 193.97348277642058
      },
      "golem_ko_0002": {
        "x": 351.3192157328249,
        "y": 151.0003269685562
      },
      "golem_ko_0003": {
        "x": 311.594344145166,
        "y": 119.65014534423969
      },
      "golem_ko_0004": {
        "x": 273.439123317729,
        "y": 99.71137724201881
      },
      "golem_ko_0005": {
        "x": 240,
        "y": 90
      }
    },
    "head": {
      "golem_idle_0000": {
        "x": 310,
        "y": 40
      },
      "golem_idle_0001": {
        "x": 310,
        "y": 37.5
      },
      "golem_idle_0002": {
        "x": 310,
        "y": 35
      },
      "golem_idle_0003": {
        "x": 310,
        "y": 37.5
      },
      "golem_walk_0000": {
        "x": 310,
        "y": 25
      },
      "golem_walk_0001": {
        "x": 310,
        "y": 28.333333333333314
      },
      "golem_walk_0002": {
        "x": 310,
        "y": 31.666666666666686
      },
      "golem_walk_0003": {
        "x": 310,
        "y": 35
      },
      "golem_walk_0004": {
        "x": 310,
        "y": 31.666666666666686
      },
      "golem_walk_0005": {
        "x": 310,
        "y": 28.333333333333314
      },
      "golem_attack_0000": {
        "x": 289.03498250416607,
        "y": 41.04912529161459
      },
      "golem_attack_0001": {
        "x": 320.2494531420896,
        "y": 40.06562158210244
      },
      "golem_attack_0002": {
        "x": 351.38200781945585,
        "y": 42.35807363343116
      },
      "golem_attack_0003": {
        "x": 337.63168416250056,
        "y": 41.04912529161459
      },
      "golem_attack_0004": {
        "x": 323.8289588801758,
        "y": 40.262445317057086
      },
      "golem_attack_0005": {
        "x": 310,
        "y": 40
      },
      "golem_hurt_0000": {
        "x": 215.4465703763061,
        "y": 55.033995472258255
      },
      "golem_hurt_0001": {
        "x": 251.18696536112424,
        "y": 45.495542716550176
      },
      "golem_hurt_0002": {
        "x": 288.2179142664737,
        "y": 40.67164167644995
      },
      "golem_ko_0000": {
        "x": 257.78824489978973,
        "y": 47.43132576444884
      },
      "golem_ko_0001": {
        "x": 178.82939848597633,
        "y": 44.19863643887135
      },
      "golem_ko_0002": {
        "x": 109.65776912052561,
        "y": 62.06310658454788
      },
      "golem_ko_0003": {
        "x": 57.97400872101957,
        "y": 93.63619794398045
      },
      "golem_ko_0004": {
        "x": 22.247750693605894,
        "y": 143.33355416166486
      },
      "golem_ko_0005": {
        "x": 10,
        "y": 200
      }
    }
  },
  "hitbox": {
    "x": 220,
    "y": 35,
    "w": 180,
    "h": 305
  },
  "atlas": "golem--snes16.atlas.json",
  "built": {
    "commit": "f716d005821cd650b1177d7112f01832f57354c6",
    "dirty": true,
    "at": "2026-09-12T11:21:02.255Z"
  }
}
