{
  "character": "bat",
  "style": "snes16",
  "scale": 2,
  "frameSize": {
    "w": 660,
    "h": 520
  },
  "pivot": {
    "x": 330,
    "y": 400
  },
  "animations": {
    "idle": {
      "fps": 6,
      "loop": true,
      "frames": [
        "bat_idle_0000",
        "bat_idle_0001",
        "bat_idle_0002",
        "bat_idle_0003"
      ]
    },
    "walk": {
      "fps": 10,
      "loop": true,
      "frames": [
        "bat_walk_0000",
        "bat_walk_0001",
        "bat_walk_0002",
        "bat_walk_0003",
        "bat_walk_0004",
        "bat_walk_0005"
      ]
    },
    "attack": {
      "fps": 12,
      "loop": false,
      "frames": [
        "bat_attack_0000",
        "bat_attack_0001",
        "bat_attack_0002",
        "bat_attack_0003",
        "bat_attack_0004",
        "bat_attack_0005"
      ]
    },
    "hurt": {
      "fps": 10,
      "loop": false,
      "frames": [
        "bat_hurt_0000",
        "bat_hurt_0001",
        "bat_hurt_0002"
      ]
    },
    "ko": {
      "fps": 8,
      "loop": false,
      "frames": [
        "bat_ko_0000",
        "bat_ko_0001",
        "bat_ko_0002",
        "bat_ko_0003",
        "bat_ko_0004",
        "bat_ko_0005"
      ]
    }
  },
  "sockets": {
    "head": {
      "bat_idle_0000": {
        "x": 330,
        "y": 130
      },
      "bat_idle_0001": {
        "x": 330,
        "y": 130
      },
      "bat_idle_0002": {
        "x": 330,
        "y": 130
      },
      "bat_idle_0003": {
        "x": 330,
        "y": 130
      },
      "bat_walk_0000": {
        "x": 330,
        "y": 120
      },
      "bat_walk_0001": {
        "x": 330,
        "y": 116.66666666666669
      },
      "bat_walk_0002": {
        "x": 330,
        "y": 113.33333333333337
      },
      "bat_walk_0003": {
        "x": 330,
        "y": 110
      },
      "bat_walk_0004": {
        "x": 330,
        "y": 113.33333333333331
      },
      "bat_walk_0005": {
        "x": 330,
        "y": 116.66666666666663
      },
      "bat_attack_0000": {
        "x": 303.6633143964377,
        "y": 131.58210011214942
      },
      "bat_attack_0001": {
        "x": 335,
        "y": 130
      },
      "bat_attack_0002": {
        "x": 379.3865061536813,
        "y": 133.5543875866133
      },
      "bat_attack_0003": {
        "x": 363.0033522702289,
        "y": 131.58210011214942
      },
      "bat_attack_0004": {
        "x": 346.52541475881117,
        "y": 130.39588121425504
      },
      "bat_attack_0005": {
        "x": 330,
        "y": 130
      },
      "bat_hurt_0000": {
        "x": 219.99718208488014,
        "y": 151.13528876963773
      },
      "bat_hurt_0001": {
        "x": 265.1457097175486,
        "y": 137.3919324565544
      },
      "bat_hurt_0002": {
        "x": 312.418767326782,
        "y": 130.7036246134237
      },
      "bat_ko_0000": {
        "x": 265.3103559585917,
        "y": 140.8759670971461
      },
      "bat_ko_0001": {
        "x": 442.4220352359622,
        "y": 102.58004197039844
      },
      "bat_ko_0002": {
        "x": 570.8852151099595,
        "y": 172.39274751564204
      },
      "bat_ko_0003": {
        "x": 591.5489723041537,
        "y": 304.49641061966213
      },
      "bat_ko_0004": {
        "x": 495.716032916349,
        "y": 397.12108947968767
      },
      "bat_ko_0005": {
        "x": 330.00000000000006,
        "y": 400
      }
    }
  },
  "hitbox": {
    "x": 260,
    "y": 130,
    "w": 150,
    "h": 270
  },
  "atlas": "bat--snes16.atlas.json",
  "built": {
    "commit": "cf0801dff02b0bfe0397c4bafef8e04b71fd5d09",
    "dirty": true,
    "at": "2026-09-12T19:10:27.496Z"
  }
}
