{
  "character": "ninja",
  "style": "snes16",
  "scale": 2,
  "frameSize": {
    "w": 960,
    "h": 630
  },
  "pivot": {
    "x": 480,
    "y": 490
  },
  "animations": {
    "idle": {
      "fps": 6,
      "loop": true,
      "frames": [
        "ninja_idle_0000",
        "ninja_idle_0001",
        "ninja_idle_0002",
        "ninja_idle_0003"
      ]
    },
    "walk": {
      "fps": 10,
      "loop": true,
      "frames": [
        "ninja_walk_0000",
        "ninja_walk_0001",
        "ninja_walk_0002",
        "ninja_walk_0003",
        "ninja_walk_0004",
        "ninja_walk_0005"
      ]
    },
    "attack": {
      "fps": 12,
      "loop": false,
      "frames": [
        "ninja_attack_0000",
        "ninja_attack_0001",
        "ninja_attack_0002",
        "ninja_attack_0003",
        "ninja_attack_0004",
        "ninja_attack_0005"
      ]
    },
    "hurt": {
      "fps": 10,
      "loop": false,
      "frames": [
        "ninja_hurt_0000",
        "ninja_hurt_0001",
        "ninja_hurt_0002"
      ]
    },
    "ko": {
      "fps": 8,
      "loop": false,
      "frames": [
        "ninja_ko_0000",
        "ninja_ko_0001",
        "ninja_ko_0002",
        "ninja_ko_0003",
        "ninja_ko_0004",
        "ninja_ko_0005"
      ]
    }
  },
  "sockets": {
    "hand": {
      "ninja_idle_0000": {
        "x": 650,
        "y": 210
      },
      "ninja_idle_0001": {
        "x": 650,
        "y": 205
      },
      "ninja_idle_0002": {
        "x": 650,
        "y": 200
      },
      "ninja_idle_0003": {
        "x": 650,
        "y": 205
      },
      "ninja_walk_0000": {
        "x": 646.7599764877662,
        "y": 161.67496830837416
      },
      "ninja_walk_0001": {
        "x": 650.4162594851249,
        "y": 187.12778111670303
      },
      "ninja_walk_0002": {
        "x": 648.088215760512,
        "y": 212.73626208744577
      },
      "ninja_walk_0003": {
        "x": 639.9020203386572,
        "y": 237.11248594857344
      },
      "ninja_walk_0004": {
        "x": 648.088215760512,
        "y": 212.73626208744577
      },
      "ninja_walk_0005": {
        "x": 650.4162594851249,
        "y": 187.12778111670303
      },
      "ninja_attack_0000": {
        "x": 604.1998631865532,
        "y": 263.3807855964253
      },
      "ninja_attack_0001": {
        "x": 673.151302369545,
        "y": 239.49441504145477
      },
      "ninja_attack_0002": {
        "x": 735.7763122596394,
        "y": 234.60388915779293
      },
      "ninja_attack_0003": {
        "x": 707.7447074749764,
        "y": 224.0901291645116
      },
      "ninja_attack_0004": {
        "x": 678.3941947043882,
        "y": 221.3552326153279
      },
      "ninja_attack_0005": {
        "x": 650,
        "y": 210
      },
      "ninja_hurt_0000": {
        "x": 579.8999804186057,
        "y": 228.79572631176245
      },
      "ninja_hurt_0001": {
        "x": 608.271752376251,
        "y": 212.48321686133914
      },
      "ninja_hurt_0002": {
        "x": 632.2639676142197,
        "y": 196.7023484580049
      },
      "ninja_ko_0000": {
        "x": 628.7310784614556,
        "y": 178.02022175912788
      },
      "ninja_ko_0001": {
        "x": 530.9738234538783,
        "y": 125.06537308011792
      },
      "ninja_ko_0002": {
        "x": 419.84369835095214,
        "y": 104.86443431406099
      },
      "ninja_ko_0003": {
        "x": 307.1822437045092,
        "y": 121.67564855045117
      },
      "ninja_ko_0004": {
        "x": 206.1049591154965,
        "y": 175.18487019021245
      },
      "ninja_ko_0005": {
        "x": 129.15969384395885,
        "y": 260.20221784648
      }
    },
    "head": {
      "ninja_idle_0000": {
        "x": 480,
        "y": 20
      },
      "ninja_idle_0001": {
        "x": 480,
        "y": 15
      },
      "ninja_idle_0002": {
        "x": 480,
        "y": 10
      },
      "ninja_idle_0003": {
        "x": 480,
        "y": 15
      },
      "ninja_walk_0000": {
        "x": 480,
        "y": 10
      },
      "ninja_walk_0001": {
        "x": 480,
        "y": 10
      },
      "ninja_walk_0002": {
        "x": 480,
        "y": 10
      },
      "ninja_walk_0003": {
        "x": 480,
        "y": 10
      },
      "ninja_walk_0004": {
        "x": 480,
        "y": 10
      },
      "ninja_walk_0005": {
        "x": 480,
        "y": 10
      },
      "ninja_attack_0000": {
        "x": 446.48058195910255,
        "y": 22.013581960917406
      },
      "ninja_attack_0001": {
        "x": 490,
        "y": 20
      },
      "ninja_attack_0002": {
        "x": 550.1282805592308,
        "y": 24.52376601932599
      },
      "ninja_attack_0003": {
        "x": 526.8527513742307,
        "y": 22.013581960917406
      },
      "ninja_attack_0004": {
        "x": 503.45658848091114,
        "y": 20.503848818142842
      },
      "ninja_attack_0005": {
        "x": 480,
        "y": 20
      },
      "ninja_hurt_0000": {
        "x": 339.99429946250655,
        "y": 44.843219092762354
      },
      "ninja_hurt_0001": {
        "x": 392.60460025644755,
        "y": 28.78375691155037
      },
      "ninja_hurt_0002": {
        "x": 447.6238856886316,
        "y": 20.895522235266526
      },
      "ninja_ko_0000": {
        "x": 401.48270599575216,
        "y": 32.66202826505514
      },
      "ninja_ko_0001": {
        "x": 279.6901299056483,
        "y": 61.31260547650646
      },
      "ninja_ko_0002": {
        "x": 173.14093759247703,
        "y": 121.85464093865028
      },
      "ninja_ko_0003": {
        "x": 90.01891852869113,
        "y": 208.85995695914016
      },
      "ninja_ko_0004": {
        "x": 36.68814915101217,
        "y": 314.8527146495482
      },
      "ninja_ko_0005": {
        "x": 17.19742877980798,
        "y": 430.8948603403632
      }
    }
  },
  "hitbox": {
    "x": 410,
    "y": 20,
    "w": 160,
    "h": 470
  },
  "atlas": "ninja--snes16.atlas.json",
  "built": {
    "commit": "cf0801dff02b0bfe0397c4bafef8e04b71fd5d09",
    "dirty": true,
    "at": "2026-09-12T19:10:27.496Z"
  }
}
