{
  "character": "robot",
  "style": "snes16",
  "scale": 1,
  "frameSize": {
    "w": 490,
    "h": 330
  },
  "pivot": {
    "x": 245,
    "y": 250
  },
  "animations": {
    "idle": {
      "fps": 6,
      "loop": true,
      "frames": [
        "robot_idle_0000",
        "robot_idle_0001",
        "robot_idle_0002",
        "robot_idle_0003"
      ]
    },
    "walk": {
      "fps": 10,
      "loop": true,
      "frames": [
        "robot_walk_0000",
        "robot_walk_0001",
        "robot_walk_0002",
        "robot_walk_0003",
        "robot_walk_0004",
        "robot_walk_0005"
      ]
    },
    "attack": {
      "fps": 12,
      "loop": false,
      "frames": [
        "robot_attack_0000",
        "robot_attack_0001",
        "robot_attack_0002",
        "robot_attack_0003",
        "robot_attack_0004",
        "robot_attack_0005"
      ]
    },
    "hurt": {
      "fps": 10,
      "loop": false,
      "frames": [
        "robot_hurt_0000",
        "robot_hurt_0001",
        "robot_hurt_0002"
      ]
    },
    "ko": {
      "fps": 8,
      "loop": false,
      "frames": [
        "robot_ko_0000",
        "robot_ko_0001",
        "robot_ko_0002",
        "robot_ko_0003",
        "robot_ko_0004",
        "robot_ko_0005"
      ]
    }
  },
  "sockets": {
    "hand": {
      "robot_idle_0000": {
        "x": 325,
        "y": 135
      },
      "robot_idle_0001": {
        "x": 325,
        "y": 132.5
      },
      "robot_idle_0002": {
        "x": 325,
        "y": 130
      },
      "robot_idle_0003": {
        "x": 325,
        "y": 132.5
      },
      "robot_walk_0000": {
        "x": 326.30702302421275,
        "y": 117.392303867533
      },
      "robot_walk_0001": {
        "x": 325.9260974695669,
        "y": 125.85794508400168
      },
      "robot_walk_0002": {
        "x": 323.5980537449539,
        "y": 134.0060981201471
      },
      "robot_walk_0003": {
        "x": 319.44906687510377,
        "y": 141.3951503894146
      },
      "robot_walk_0004": {
        "x": 323.5980537449539,
        "y": 134.0060981201471
      },
      "robot_walk_0005": {
        "x": 325.9260974695669,
        "y": 125.85794508400168
      },
      "robot_attack_0000": {
        "x": 300.1284443030431,
        "y": 148.26037148554002
      },
      "robot_attack_0001": {
        "x": 337.45664845814684,
        "y": 146.72998080670956
      },
      "robot_attack_0002": {
        "x": 371.0854248141658,
        "y": 149.70835448921642
      },
      "robot_attack_0003": {
        "x": 356.0627339542763,
        "y": 143.58360167397848
      },
      "robot_attack_0004": {
        "x": 340.1055547497097,
        "y": 140.4047881762387
      },
      "robot_attack_0005": {
        "x": 325,
        "y": 135
      },
      "robot_hurt_0000": {
        "x": 282.7853025971413,
        "y": 134.72460858585026
      },
      "robot_hurt_0001": {
        "x": 299.6607483520348,
        "y": 131.54285477671664
      },
      "robot_hurt_0002": {
        "x": 314.94925486605916,
        "y": 128.79872210430904
      },
      "robot_ko_0000": {
        "x": 311.4851663795956,
        "y": 120.30245886592061
      },
      "robot_ko_0001": {
        "x": 273.5175702076664,
        "y": 97.15204920225099
      },
      "robot_ko_0002": {
        "x": 230.0154214861789,
        "y": 85.8220841555852
      },
      "robot_ko_0003": {
        "x": 184.99073537056526,
        "y": 88.13428908684423
      },
      "robot_ko_0004": {
        "x": 143.0604088978691,
        "y": 104.42043611026727
      },
      "robot_ko_0005": {
        "x": 108.85327658266701,
        "y": 133.3363711169726
      }
    },
    "head": {
      "robot_idle_0000": {
        "x": 245,
        "y": 10
      },
      "robot_idle_0001": {
        "x": 245,
        "y": 7.5
      },
      "robot_idle_0002": {
        "x": 245,
        "y": 5
      },
      "robot_idle_0003": {
        "x": 245,
        "y": 7.5
      },
      "robot_walk_0000": {
        "x": 245,
        "y": 5
      },
      "robot_walk_0001": {
        "x": 245,
        "y": 5
      },
      "robot_walk_0002": {
        "x": 245,
        "y": 5
      },
      "robot_walk_0003": {
        "x": 245,
        "y": 5
      },
      "robot_walk_0004": {
        "x": 245,
        "y": 5
      },
      "robot_walk_0005": {
        "x": 245,
        "y": 5
      },
      "robot_attack_0000": {
        "x": 222.85324165154992,
        "y": 11.330402367034736
      },
      "robot_attack_0001": {
        "x": 255.5491675374617,
        "y": 10.083243756437298
      },
      "robot_attack_0002": {
        "x": 288.1204710837775,
        "y": 12.98891683419754
      },
      "robot_attack_0003": {
        "x": 273.81342501511676,
        "y": 11.330402367034736
      },
      "robot_attack_0004": {
        "x": 259.4266745320306,
        "y": 10.332900111987243
      },
      "robot_attack_0005": {
        "x": 245,
        "y": 10
      },
      "robot_hurt_0000": {
        "x": 151.47622442937364,
        "y": 29.058006053703423
      },
      "robot_hurt_0001": {
        "x": 187.36055892298165,
        "y": 16.60604140464278
      },
      "robot_hurt_0002": {
        "x": 225.21578161570307,
        "y": 10.591684334015383
      },
      "robot_ko_0000": {
        "x": 188.2175275939868,
        "y": 19.88326940239773
      },
      "robot_ko_0001": {
        "x": 127.638980757029,
        "y": 39.27998708389134
      },
      "robot_ko_0002": {
        "x": 76.11904459577477,
        "y": 74.31981186145285
      },
      "robot_ko_0003": {
        "x": 37.603078244054586,
        "y": 121.89040108753079
      },
      "robot_ko_0004": {
        "x": 15.018821516028254,
        "y": 177.914113233403
      },
      "robot_ko_0005": {
        "x": 10.049849897519039,
        "y": 237.66910205197937
      }
    }
  },
  "hitbox": {
    "x": 205,
    "y": 10,
    "w": 85,
    "h": 240
  },
  "atlas": "robot--snes16.atlas.json",
  "built": {
    "commit": "f716d005821cd650b1177d7112f01832f57354c6",
    "dirty": true,
    "at": "2026-09-12T11:21:02.255Z"
  }
}
