{
  "character": "teddy",
  "style": "snes16",
  "scale": 2,
  "frameSize": {
    "w": 680,
    "h": 470
  },
  "pivot": {
    "x": 340,
    "y": 350
  },
  "animations": {
    "idle": {
      "fps": 6,
      "loop": true,
      "frames": [
        "teddy_idle_0000",
        "teddy_idle_0001",
        "teddy_idle_0002",
        "teddy_idle_0003"
      ]
    },
    "walk": {
      "fps": 10,
      "loop": true,
      "frames": [
        "teddy_walk_0000",
        "teddy_walk_0001",
        "teddy_walk_0002",
        "teddy_walk_0003",
        "teddy_walk_0004",
        "teddy_walk_0005"
      ]
    },
    "attack": {
      "fps": 12,
      "loop": false,
      "frames": [
        "teddy_attack_0000",
        "teddy_attack_0001",
        "teddy_attack_0002",
        "teddy_attack_0003",
        "teddy_attack_0004",
        "teddy_attack_0005"
      ]
    },
    "hurt": {
      "fps": 10,
      "loop": false,
      "frames": [
        "teddy_hurt_0000",
        "teddy_hurt_0001",
        "teddy_hurt_0002"
      ]
    },
    "ko": {
      "fps": 8,
      "loop": false,
      "frames": [
        "teddy_ko_0000",
        "teddy_ko_0001",
        "teddy_ko_0002",
        "teddy_ko_0003",
        "teddy_ko_0004",
        "teddy_ko_0005"
      ]
    }
  },
  "sockets": {
    "hand": {
      "teddy_idle_0000": {
        "x": 450,
        "y": 240
      },
      "teddy_idle_0001": {
        "x": 450,
        "y": 240
      },
      "teddy_idle_0002": {
        "x": 450,
        "y": 240
      },
      "teddy_idle_0003": {
        "x": 450,
        "y": 240
      },
      "teddy_walk_0000": {
        "x": 451.00388658844963,
        "y": 225.67781483025573
      },
      "teddy_walk_0001": {
        "x": 450.8921082706041,
        "y": 235.27593415284844
      },
      "teddy_walk_0002": {
        "x": 448.5640645459911,
        "y": 244.58810905130036
      },
      "teddy_walk_0003": {
        "x": 444.14593043934065,
        "y": 253.10963942669184
      },
      "teddy_walk_0004": {
        "x": 448.5640645459911,
        "y": 244.58810905130036
      },
      "teddy_walk_0005": {
        "x": 450.8921082706041,
        "y": 235.27593415284844
      },
      "teddy_attack_0000": {
        "x": 420.3640523425855,
        "y": 253.5343333822597
      },
      "teddy_attack_0001": {
        "x": 461.9146790626852,
        "y": 253.97683452530813
      },
      "teddy_attack_0002": {
        "x": 498.8081900322961,
        "y": 260.06765612088486
      },
      "teddy_attack_0003": {
        "x": 482.9941899305796,
        "y": 252.00352723916987
      },
      "teddy_attack_0004": {
        "x": 466.6852186002413,
        "y": 245.3045814597766
      },
      "teddy_attack_0005": {
        "x": 450,
        "y": 240
      },
      "teddy_hurt_0000": {
        "x": 404.40059933752286,
        "y": 233.36756934387952
      },
      "teddy_hurt_0001": {
        "x": 426.069223669515,
        "y": 232.1903162576627
      },
      "teddy_hurt_0002": {
        "x": 445.6524529948295,
        "y": 231.36929834826003
      },
      "teddy_ko_0000": {
        "x": 437.8738570227835,
        "y": 219.14304472048119
      },
      "teddy_ko_0001": {
        "x": 397.9887795236322,
        "y": 186.5454387057222
      },
      "teddy_ko_0002": {
        "x": 350.2828937660113,
        "y": 166.82097318618693
      },
      "teddy_ko_0003": {
        "x": 299.2488652122026,
        "y": 162.407910865333
      },
      "teddy_ko_0004": {
        "x": 250.14497981984488,
        "y": 174.04811149039534
      },
      "teddy_ko_0005": {
        "x": 208.31584538817134,
        "y": 200.5636934239155
      }
    },
    "head": {
      "teddy_idle_0000": {
        "x": 340,
        "y": 30
      },
      "teddy_idle_0001": {
        "x": 342.5499043760758,
        "y": 30.01912464140895
      },
      "teddy_idle_0002": {
        "x": 345.0992350344243,
        "y": 30.0764942626721
      },
      "teddy_idle_0003": {
        "x": 342.5499043760758,
        "y": 30.01912464140895
      },
      "teddy_walk_0000": {
        "x": 340,
        "y": 30
      },
      "teddy_walk_0001": {
        "x": 340,
        "y": 30
      },
      "teddy_walk_0002": {
        "x": 340,
        "y": 30
      },
      "teddy_walk_0003": {
        "x": 340,
        "y": 30
      },
      "teddy_walk_0004": {
        "x": 340,
        "y": 30
      },
      "teddy_walk_0005": {
        "x": 340,
        "y": 30
      },
      "teddy_attack_0000": {
        "x": 308.874826104881,
        "y": 31.869754677994763
      },
      "teddy_attack_0001": {
        "x": 352.7988300526489,
        "y": 30.11699122526329
      },
      "teddy_attack_0002": {
        "x": 396.5476890907143,
        "y": 34.20063987508843
      },
      "teddy_attack_0003": {
        "x": 377.7918405617857,
        "y": 31.869754677994763
      },
      "teddy_attack_0004": {
        "x": 358.92397501798894,
        "y": 30.46785961684691
      },
      "teddy_attack_0005": {
        "x": 340,
        "y": 30
      },
      "teddy_hurt_0000": {
        "x": 204.5463524822674,
        "y": 59.09054722857945
      },
      "teddy_hurt_0001": {
        "x": 260.33389934342244,
        "y": 39.98423442405664
      },
      "teddy_hurt_0002": {
        "x": 319.2221795680151,
        "y": 30.831556361318917
      },
      "teddy_ko_0000": {
        "x": 255.9186420359739,
        "y": 45.213639013797774
      },
      "teddy_ko_0001": {
        "x": 175.4846474459646,
        "y": 74.35330570798914
      },
      "teddy_ko_0002": {
        "x": 107.9544189574604,
        "y": 124.28261119922792
      },
      "teddy_ko_0003": {
        "x": 58.565722898028355,
        "y": 190.5911807165462
      },
      "teddy_ko_0004": {
        "x": 31.11820329754937,
        "y": 267.5920904328175
      },
      "teddy_ko_0005": {
        "x": 27.676266838560764,
        "y": 348.77492655506217
      }
    }
  },
  "hitbox": {
    "x": 260,
    "y": 50,
    "w": 170,
    "h": 300
  },
  "atlas": "teddy--snes16.atlas.json",
  "built": {
    "commit": "a164d58132cbbe6b6158ad329740088680405f42",
    "dirty": true,
    "at": "2026-09-11T18:06:51.209Z"
  }
}
