{
  "character": "wizard",
  "style": "snes16",
  "scale": 2,
  "frameSize": {
    "w": 1000,
    "h": 640
  },
  "pivot": {
    "x": 500,
    "y": 500
  },
  "animations": {
    "idle": {
      "fps": 6,
      "loop": true,
      "frames": [
        "wizard_idle_0000",
        "wizard_idle_0001",
        "wizard_idle_0002",
        "wizard_idle_0003"
      ]
    },
    "walk": {
      "fps": 10,
      "loop": true,
      "frames": [
        "wizard_walk_0000",
        "wizard_walk_0001",
        "wizard_walk_0002",
        "wizard_walk_0003",
        "wizard_walk_0004",
        "wizard_walk_0005"
      ]
    },
    "attack": {
      "fps": 12,
      "loop": false,
      "frames": [
        "wizard_attack_0000",
        "wizard_attack_0001",
        "wizard_attack_0002",
        "wizard_attack_0003",
        "wizard_attack_0004",
        "wizard_attack_0005"
      ]
    },
    "hurt": {
      "fps": 10,
      "loop": false,
      "frames": [
        "wizard_hurt_0000",
        "wizard_hurt_0001",
        "wizard_hurt_0002"
      ]
    },
    "ko": {
      "fps": 8,
      "loop": false,
      "frames": [
        "wizard_ko_0000",
        "wizard_ko_0001",
        "wizard_ko_0002",
        "wizard_ko_0003",
        "wizard_ko_0004",
        "wizard_ko_0005"
      ]
    }
  },
  "sockets": {
    "hand": {
      "wizard_idle_0000": {
        "x": 640,
        "y": 80
      },
      "wizard_idle_0001": {
        "x": 640,
        "y": 75
      },
      "wizard_idle_0002": {
        "x": 640,
        "y": 70
      },
      "wizard_idle_0003": {
        "x": 640,
        "y": 75
      },
      "wizard_walk_0000": {
        "x": 625.54791463351,
        "y": 68.03100947133396
      },
      "wizard_walk_0001": {
        "x": 631.441054243733,
        "y": 67.7134972693218
      },
      "wizard_walk_0002": {
        "x": 648.4339717957637,
        "y": 72.71141419638968
      },
      "wizard_walk_0003": {
        "x": 653.6519550266944,
        "y": 74.60304016377665
      },
      "wizard_walk_0004": {
        "x": 648.4339717957637,
        "y": 72.71141419638968
      },
      "wizard_walk_0005": {
        "x": 631.441054243733,
        "y": 67.7134972693218
      },
      "wizard_attack_0000": {
        "x": 689.2723290880141,
        "y": 127.13575624158648
      },
      "wizard_attack_0001": {
        "x": 724.9917461688735,
        "y": 106.25467475893663
      },
      "wizard_attack_0002": {
        "x": 750.4110641316337,
        "y": 110.03323406690674
      },
      "wizard_attack_0003": {
        "x": 714.3090689571787,
        "y": 97.3086242376699
      },
      "wizard_attack_0004": {
        "x": 677.4313039747467,
        "y": 87.28253890062308
      },
      "wizard_attack_0005": {
        "x": 640,
        "y": 80
      },
      "wizard_hurt_0000": {
        "x": 591.9263002111313,
        "y": 85.15132586581615
      },
      "wizard_hurt_0001": {
        "x": 597.0801292556438,
        "y": 73.29818846670855
      },
      "wizard_hurt_0002": {
        "x": 599.1846551740811,
        "y": 70.0272944493205
      },
      "wizard_ko_0000": {
        "x": 561.7149751956506,
        "y": 59.760994109019634
      },
      "wizard_ko_0001": {
        "x": 418.5061546096109,
        "y": 56.60754110523999
      },
      "wizard_ko_0002": {
        "x": 287.77229715839263,
        "y": 101.21901478871871
      },
      "wizard_ko_0003": {
        "x": 185.5510691403664,
        "y": 185.2887700524675
      },
      "wizard_ko_0004": {
        "x": 123.36465241486229,
        "y": 295.23093965798364
      },
      "wizard_ko_0005": {
        "x": 106.58087767054468,
        "y": 414.4176938767373
      }
    },
    "head": {
      "wizard_idle_0000": {
        "x": 510,
        "y": 20
      },
      "wizard_idle_0001": {
        "x": 510,
        "y": 15
      },
      "wizard_idle_0002": {
        "x": 510,
        "y": 10
      },
      "wizard_idle_0003": {
        "x": 510,
        "y": 15
      },
      "wizard_walk_0000": {
        "x": 523.193520426588,
        "y": 10.497940152470392
      },
      "wizard_walk_0001": {
        "x": 510,
        "y": 10
      },
      "wizard_walk_0002": {
        "x": 510,
        "y": 10
      },
      "wizard_walk_0003": {
        "x": 496.79748024839176,
        "y": 9.898030148420503
      },
      "wizard_walk_0004": {
        "x": 510,
        "y": 10
      },
      "wizard_walk_0005": {
        "x": 510,
        "y": 10
      },
      "wizard_attack_0000": {
        "x": 457.25471515141413,
        "y": 21.967078151409623
      },
      "wizard_attack_0001": {
        "x": 533.193520426588,
        "y": 20.49794015247039
      },
      "wizard_attack_0002": {
        "x": 608.6114492352439,
        "y": 28.899070907484827
      },
      "wizard_attack_0003": {
        "x": 575.9347908989965,
        "y": 24.361322297187996
      },
      "wizard_attack_0004": {
        "x": 543.0328349169744,
        "y": 21.391402493304554
      },
      "wizard_attack_0005": {
        "x": 510,
        "y": 20
      },
      "wizard_hurt_0000": {
        "x": 303.06294983574173,
        "y": 54.98746590864687
      },
      "wizard_hurt_0001": {
        "x": 382.2185347492598,
        "y": 31.06154307676843
      },
      "wizard_hurt_0002": {
        "x": 464.80555171659023,
        "y": 20.608102287155702
      },
      "wizard_ko_0000": {
        "x": 383.64630208748406,
        "y": 36.67763909443852
      },
      "wizard_ko_0001": {
        "x": 264.57520651468883,
        "y": 74.94836559320868
      },
      "wizard_ko_0002": {
        "x": 162.93754896054736,
        "y": 143.26988599695215
      },
      "wizard_ko_0003": {
        "x": 86.1497589818448,
        "y": 235.7958134981572
      },
      "wizard_ko_0004": {
        "x": 39.758112141584434,
        "y": 344.9019171353942
      },
      "wizard_ko_0005": {
        "x": 27.029419446170095,
        "y": 461.7645219122869
      }
    }
  },
  "hitbox": {
    "x": 400,
    "y": 20,
    "w": 220,
    "h": 480
  },
  "atlas": "wizard--snes16.atlas.json",
  "built": {
    "commit": "cf0801dff02b0bfe0397c4bafef8e04b71fd5d09",
    "dirty": true,
    "at": "2026-09-12T19:10:27.496Z"
  }
}
