{
  "character": "knight",
  "style": "snes16",
  "scale": 2,
  "frameSize": {
    "w": 1000,
    "h": 690
  },
  "pivot": {
    "x": 500,
    "y": 550
  },
  "animations": {
    "idle": {
      "fps": 6,
      "loop": true,
      "frames": [
        "knight_idle_0000",
        "knight_idle_0001",
        "knight_idle_0002",
        "knight_idle_0003"
      ]
    },
    "walk": {
      "fps": 10,
      "loop": true,
      "frames": [
        "knight_walk_0000",
        "knight_walk_0001",
        "knight_walk_0002",
        "knight_walk_0003",
        "knight_walk_0004",
        "knight_walk_0005"
      ]
    },
    "attack": {
      "fps": 12,
      "loop": false,
      "frames": [
        "knight_attack_0000",
        "knight_attack_0001",
        "knight_attack_0002",
        "knight_attack_0003",
        "knight_attack_0004",
        "knight_attack_0005"
      ]
    },
    "hurt": {
      "fps": 10,
      "loop": false,
      "frames": [
        "knight_hurt_0000",
        "knight_hurt_0001",
        "knight_hurt_0002"
      ]
    },
    "ko": {
      "fps": 8,
      "loop": false,
      "frames": [
        "knight_ko_0000",
        "knight_ko_0001",
        "knight_ko_0002",
        "knight_ko_0003",
        "knight_ko_0004",
        "knight_ko_0005"
      ]
    }
  },
  "sockets": {
    "hand": {
      "knight_idle_0000": {
        "x": 620,
        "y": 280
      },
      "knight_idle_0001": {
        "x": 620,
        "y": 275
      },
      "knight_idle_0002": {
        "x": 620,
        "y": 270
      },
      "knight_idle_0003": {
        "x": 620,
        "y": 275
      },
      "knight_walk_0000": {
        "x": 627.8618427375587,
        "y": 254.4652690872033
      },
      "knight_walk_0001": {
        "x": 623.2201519952171,
        "y": 265.13997735699724
      },
      "knight_walk_0002": {
        "x": 616.2360208213781,
        "y": 274.45215225544916
      },
      "knight_walk_0003": {
        "x": 607.2879742902317,
        "y": 281.8970936836394
      },
      "knight_walk_0004": {
        "x": 616.2360208213781,
        "y": 274.45215225544916
      },
      "knight_walk_0005": {
        "x": 623.2201519952171,
        "y": 265.13997735699724
      },
      "knight_attack_0000": {
        "x": 569.7546833821732,
        "y": 289.6417734393649
      },
      "knight_attack_0001": {
        "x": 643.2994562496795,
        "y": 293.6896808807935
      },
      "knight_attack_0002": {
        "x": 712.0459566859558,
        "y": 306.7220485755896
      },
      "knight_attack_0003": {
        "x": 682.0033946830833,
        "y": 295.36812134093356
      },
      "knight_attack_0004": {
        "x": 651.2523514508337,
        "y": 286.4469383812843
      },
      "knight_attack_0005": {
        "x": 620,
        "y": 280
      },
      "knight_hurt_0000": {
        "x": 534.401943562645,
        "y": 273.09217792972976
      },
      "knight_hurt_0001": {
        "x": 568.5849884058241,
        "y": 271.62051045765
      },
      "knight_hurt_0002": {
        "x": 600.8255884197054,
        "y": 270.76204903041116
      },
      "knight_ko_0000": {
        "x": 595.7543629534923,
        "y": 258.35235674205603
      },
      "knight_ko_0001": {
        "x": 515.3836804666224,
        "y": 226.49617779136906
      },
      "knight_ko_0002": {
        "x": 429.0386166275532,
        "y": 217.32259797674277
      },
      "knight_ko_0003": {
        "x": 343.4943170620039,
        "y": 232.8706229054245
      },
      "knight_ko_0004": {
        "x": 266.31802908376335,
        "y": 272.962154308944
      },
      "knight_ko_0005": {
        "x": 205.06200175089594,
        "y": 334.8918034919425
      }
    },
    "head": {
      "knight_idle_0000": {
        "x": 500,
        "y": 70
      },
      "knight_idle_0001": {
        "x": 500,
        "y": 65
      },
      "knight_idle_0002": {
        "x": 500,
        "y": 60
      },
      "knight_idle_0003": {
        "x": 500,
        "y": 65
      },
      "knight_walk_0000": {
        "x": 500,
        "y": 60
      },
      "knight_walk_0001": {
        "x": 500,
        "y": 60
      },
      "knight_walk_0002": {
        "x": 500,
        "y": 60
      },
      "knight_walk_0003": {
        "x": 500,
        "y": 60
      },
      "knight_walk_0004": {
        "x": 500,
        "y": 60
      },
      "knight_walk_0005": {
        "x": 500,
        "y": 60
      },
      "knight_attack_0000": {
        "x": 461.6920936675458,
        "y": 72.3012365267628
      },
      "knight_attack_0001": {
        "x": 519.5985600647986,
        "y": 70.14398920032397
      },
      "knight_attack_0002": {
        "x": 577.2894634962637,
        "y": 75.17001830780112
      },
      "knight_attack_0003": {
        "x": 551.6412396657876,
        "y": 72.3012365267628
      },
      "knight_attack_0004": {
        "x": 525.8551487400889,
        "y": 70.57582722073471
      },
      "knight_attack_0005": {
        "x": 500,
        "y": 70
      },
      "knight_hurt_0000": {
        "x": 341.3584805279734,
        "y": 99.71411853972108
      },
      "knight_hurt_0001": {
        "x": 401.4215171698545,
        "y": 80.43982319295611
      },
      "knight_hurt_0002": {
        "x": 464.4272979298647,
        "y": 71.02345398316174
      },
      "knight_ko_0000": {
        "x": 407.81346241854203,
        "y": 85.22953266655622
      },
      "knight_ko_0001": {
        "x": 284.822925851022,
        "y": 117.91807026844742
      },
      "knight_ko_0002": {
        "x": 178.2245577090972,
        "y": 182.58942216027447
      },
      "knight_ko_0003": {
        "x": 96.16160592402179,
        "y": 273.4994962939418
      },
      "knight_ko_0004": {
        "x": 44.8735999475939,
        "y": 382.8854394752217
      },
      "knight_ko_0005": {
        "x": 28.213432511300766,
        "y": 501.5726231324459
      }
    },
    "shield": {
      "knight_idle_0000": {
        "x": 380,
        "y": 310
      },
      "knight_idle_0001": {
        "x": 380,
        "y": 305
      },
      "knight_idle_0002": {
        "x": 380,
        "y": 300
      },
      "knight_idle_0003": {
        "x": 380,
        "y": 305
      },
      "knight_walk_0000": {
        "x": 362.457495910304,
        "y": 279.2174723980702
      },
      "knight_walk_0001": {
        "x": 373.35576081578904,
        "y": 293.77202030091394
      },
      "knight_walk_0002": {
        "x": 387.3240231634669,
        "y": 305.41223892397886
      },
      "knight_walk_0003": {
        "x": 403.6052328049581,
        "y": 313.5072531436153
      },
      "knight_walk_0004": {
        "x": 387.3240231634669,
        "y": 305.41223892397886
      },
      "knight_walk_0005": {
        "x": 373.35576081578904,
        "y": 293.77202030091394
      },
      "knight_attack_0000": {
        "x": 371.2859871144225,
        "y": 324.94077400636104
      },
      "knight_attack_0001": {
        "x": 392.45363596632114,
        "y": 306.4365372757815
      },
      "knight_attack_0002": {
        "x": 416.2611227394914,
        "y": 289.8089557658514
      },
      "knight_attack_0003": {
        "x": 403.77327361398295,
        "y": 296.20984425702034
      },
      "knight_attack_0004": {
        "x": 391.67972239279777,
        "y": 302.9482760276503
      },
      "knight_attack_0005": {
        "x": 380,
        "y": 310
      },
      "knight_hurt_0000": {
        "x": 377.6727329927358,
        "y": 353.402249566323
      },
      "knight_hurt_0001": {
        "x": 368.94036860484437,
        "y": 342.2107956571024
      },
      "knight_hurt_0002": {
        "x": 363.99061972615186,
        "y": 319.8456267720911
      },
      "knight_ko_0000": {
        "x": 366.4984641954461,
        "y": 335.43499346810796
      },
      "knight_ko_0001": {
        "x": 298.13651342600207,
        "y": 362.22879859277475
      },
      "knight_ko_0002": {
        "x": 241.45823304214088,
        "y": 407.4229424391216
      },
      "knight_ko_0003": {
        "x": 201.17190168117008,
        "y": 467.28892102012975
      },
      "knight_ko_0004": {
        "x": 180.81799214126323,
        "y": 536.926979829799
      },
      "knight_ko_0005": {
        "x": 182.48591646587204,
        "y": 610.6249113325244
      }
    }
  },
  "hitbox": {
    "x": 440,
    "y": 70,
    "w": 130,
    "h": 480
  },
  "atlas": "knight--snes16.atlas.json",
  "built": {
    "commit": "cf0801dff02b0bfe0397c4bafef8e04b71fd5d09",
    "dirty": true,
    "at": "2026-09-12T19:10:27.496Z"
  }
}
